{
  "metadata": {
    "analysis_id": "EX-TN-FICTIONAL-001",
    "unit": "Проект «Цифровой двойник крыла БВС из композитов»",
    "industry": "Беспилотные авиационные системы",
    "period": null,
    "date": "2026-07-30"
  },
  "executive_summary": "По имеющимся данным проект соответствует диапазону F1–F2: есть цифровой двойник изделия и признаки цифрового проектирования, но связность данных, валидация и суверенитет не подтверждены. Заявления о валидации, суверенитете и переносимости пока не доказаны и требуют проверки.",
  "claims": [
    {
      "claim_id": "C1",
      "claim_type": "EMP",
      "claim": "Заявлено сокращение числа натурных испытаний на 40% и сроков на 30%.",
      "scope": { "actor": "Предприятие", "object": "разработка крыла", "industry": "БАС", "period": null },
      "trl": null,
      "metric": "число натурных испытаний; срок разработки",
      "baseline": "не указана",
      "evidence": ["Указано в описании кейса"],
      "source_refs": ["examples/fictional_case_input.json"],
      "inference_rule": null,
      "alternative_explanations": ["Эффект может частично объясняться реорганизацией процессов и опытом команды"],
      "limitations": ["Базовая линия и методика измерения не предоставлены"],
      "confidence": "low",
      "verification_date": "2026-07-30"
    },
    {
      "claim_id": "C2",
      "claim_type": "INF",
      "claim": "Заявление о технологическом суверенитете не подтверждается: ключевая CAE-платформа импортная, данные испытаний хранятся у поставщика.",
      "scope": { "actor": "Предприятие", "object": "технологический стек", "industry": "БАС", "period": null },
      "trl": null,
      "metric": null,
      "baseline": null,
      "evidence": ["Импортная платформа", "Данные у поставщика", "Обучены только два расчётчика"],
      "source_refs": ["examples/fictional_case_input.json"],
      "inference_rule": "Суверенитет требует владения ПО, данными и способности развивать решение, а не только эксплуатации.",
      "alternative_explanations": ["Возможен план миграции на отечественную платформу, не указанный в описании"],
      "limitations": ["Лицензионные условия и права на данные не предоставлены"],
      "confidence": "medium",
      "verification_date": "2026-07-30"
    },
    {
      "claim_id": "C3",
      "claim_type": "TRL",
      "claim": "Ключевая технология (валидированный цифровой двойник крыла) оценивается ориентировочно как TRL 4–6: прототип есть, серийная и сертификационная готовность не показана.",
      "scope": { "actor": "Предприятие", "object": "цифровой двойник крыла", "industry": "БАС", "period": null },
      "trl": 5,
      "metric": null,
      "baseline": null,
      "evidence": ["Серийное производство не начато", "Валидация не подтверждена документально"],
      "source_refs": ["examples/fictional_case_input.json"],
      "inference_rule": "TRL присваивается по стадии проверки, а не по факту наличия модели.",
      "alternative_explanations": ["При наличии протоколов валидации оценка может вырасти"],
      "limitations": ["Отчёты о валидации не предоставлены"],
      "confidence": "low",
      "verification_date": "2026-07-30"
    }
  ],
  "mechanism_map": [
    {
      "challenge": "дорогие и долгие натурные испытания композитного крыла",
      "technology": "цифровой двойник изделия и CAE-моделирование",
      "solution": "перенос части испытаний в виртуальную среду",
      "effect": "заявленное сокращение испытаний и сроков (не верифицировано)",
      "system_consequence": "потенциальный рост скорости разработки при подтверждённой валидации",
      "status": "hypothesis",
      "source_refs": ["examples/fictional_case_input.json"]
    }
  ],
  "maturity_assessment": {
    "dominant_level": "F2",
    "range": ["F1", "F2"],
    "dimensions": [
      { "id": "design", "direction": "possible_positive", "reason": "Есть цифровое проектирование и двойник изделия" },
      { "id": "plm", "direction": "uncertain", "reason": "Связность данных и цифровая нить не подтверждены" },
      { "id": "production", "direction": "partial_positive", "reason": "Аддитивно печатаются оснастка и кронштейны" },
      { "id": "data_intelligence", "direction": "unknown", "reason": "Нет данных о MES/IIoT/аналитике" },
      { "id": "sovereignty_materials", "direction": "negative_risk", "reason": "Импортная платформа, данные у поставщика" }
    ],
    "contradictory_features": [
      "Цифровой двойник изделия сочетается с внешним владением данными и импортным ПО",
      "Аддитивное производство оснастки при неподтверждённой серийной готовности"
    ]
  },
  "trl_assessment": {
    "key_technology": "валидированный цифровой двойник композитного крыла",
    "trl": 5,
    "justification": "Прототип и расчётная модель есть; валидация по натурным данным и серийная готовность не подтверждены."
  },
  "alternatives": [
    "Сокращение сроков может частично объясняться опытом команды и реорганизацией процессов",
    "Аддитивная оснастка могла быть внедрена независимо от цифрового двойника"
  ],
  "lever_options": [
    { "lever": "digital_design_and_virtual_testing", "option": "Провести и задокументировать независимую валидацию двойника по натурным испытаниям; согласовать допустимость виртуальных результатов с нормативной базой" },
    { "lever": "smart_and_additive_manufacturing", "option": "Оценить экономику аддитивной оснастки и подготовить перенос решения в серию" },
    { "lever": "cross_industry_transfer_and_sovereign_platforms", "option": "Проработать миграцию на отечественную платформу цифровых двойников и закрепить права на данные и модели" }
  ],
  "tradeoffs": [
    "Скорость внедрения на импортной платформе против технологического суверенитета",
    "Экономия на натурных испытаниях против рисков недостаточной валидации"
  ],
  "unknowns": [
    "Базовая линия и методика измерения эффекта",
    "Протоколы валидации цифрового двойника",
    "Лицензионные условия и права на данные и модели",
    "План миграции на отечественное ПО",
    "Глубина компетенций команды и план подготовки кадров"
  ],
  "overall_confidence": "low"
}
